{
  "artifact": "VerificationReport",
  "run_id": "2026-10-23-agent-framework-adoption",
  "results": [
    {
      "result_id": "V1",
      "claim": "Public adoption snapshots (PyPI monthly downloads and GitHub stars/forks/contributors/licenses) recorded for LangChain, LangGraph, CrewAI, AutoGen, OpenAI Agents SDK, Google ADK, Pydantic AI, and Mastra are accurate as of 2026-10-24.",
      "evidence_ids": [
        "E7",
        "E8",
        "E9",
        "E10",
        "E11",
        "E12",
        "E13",
        "E14"
      ],
      "status": "verified",
      "reason": "Auditor re-ran both APIs independently: every PyPI last-month figure matched exactly (170457766, 44769952, 2442764, 12449784, 10109331, 5383780, 379923); GitHub star counts drifted by single digits (live counters, e.g. LangGraph 43800 vs recorded 43794) — consistent with same-day retrieval, no discrepancy. Licenses re-confirmed (autogen CC-BY-4.0, mastra NOASSERTION).",
      "confidence": "high"
    },
    {
      "result_id": "V2",
      "claim": "The agentgid weekly-download and star rankings (LangChain 39.1M/wk, LangGraph 14.4M/wk; stars LangChain 148K, AutoGen 61.5K, CrewAI 60K) are consistent with primary registry data.",
      "evidence_ids": [
        "E1",
        "E2",
        "E7",
        "E8",
        "E9",
        "E10"
      ],
      "status": "verified",
      "reason": "Page opened; tracker's weekly figures sit close to the pypistats last-week values the auditor re-ran (LangChain 39.1M vs 37.3M; LangGraph 14.4M vs 13.1M) — differences consistent with different measurement windows, not contradiction. Star rankings match live API magnitudes.",
      "confidence": "medium"
    },
    {
      "result_id": "V3",
      "claim": "Six-month star-growth deltas (AutoGen +1,982; CrewAI +2,540; Google ADK +1,900 at 11 months of age; LangGraph +2,351; OpenAI Agents SDK +1,554 at 12 months) accurately describe trailing-2026 growth.",
      "evidence_ids": [
        "E3"
      ],
      "status": "partially_supported",
      "reason": "The table's ABSOLUTE star counts are stale against the live API (LangGraph shown 26.1K vs 43.8K live 2026-10-24 — a ~17K gap no 6-month window closes), so the page predates the current snapshot by an unknown interval and its publication_date is unknown. The DELTAS remain the only usable part and are internally consistent with the young-framework pattern (E11/E12). Report must use deltas only and flag the unknown collection date.",
      "confidence": "medium"
    },
    {
      "result_id": "V4",
      "claim": "Stack Overflow's April 2026 pulse survey (~1,100 developers) reported adoption of LangChain 22%, OpenClaw 17%, LangGraph 14%.",
      "evidence_ids": [
        "E4"
      ],
      "status": "verified",
      "reason": "Page opened; the sentence appears as quoted with sample size and date. This verifies the citation, not the survey's methodology — a ~1,100-respondent pulse is self-selected and 'OpenClaw' is an ambiguous category (see unresolved questions).",
      "confidence": "medium"
    },
    {
      "result_id": "V5",
      "claim": "Agent frameworks appear in 18% of organizations running LLM applications, up from 9% a year earlier.",
      "evidence_ids": [
        "E5"
      ],
      "status": "unresolved",
      "reason": "The page attributes this to 'additional research' without naming the study, sample, or date. The auditor could not trace the underlying source within the bounded audit. Statistic is decision-relevant (org-level adoption) but provenance is anonymous — the report must either drop it or present it with this caveat.",
      "confidence": "low"
    },
    {
      "result_id": "V6",
      "claim": "Microsoft retired AutoGen; Agent Framework is its sole agent framework and AutoGen/Semantic Kernel remain in maintenance mode.",
      "evidence_ids": [
        "E6",
        "E10"
      ],
      "status": "verified",
      "reason": "Press page opened and states it; direction corroborated by primary repo state the auditor re-checked (microsoft/autogen pushed_at 2026-10-16, both autogen PyPI packages summing to ~0.79M downloads/month vs 12.4M for the 19-month-old openai-agents) and by the migration guide's existence on learn.microsoft.com.",
      "confidence": "high"
    },
    {
      "result_id": "V7",
      "claim": "OpenAI Agents SDK shows the fastest raw growth in the candidate set (30.2K stars and 12.4M monthly PyPI downloads within ~19 months of repo creation 2025-03-11).",
      "evidence_ids": [
        "E11",
        "E3",
        "E2"
      ],
      "status": "verified",
      "reason": "API re-run match (12449784 downloads; 30247 stars). Corroborated by the independent +1,554-stars-in-6-months delta (E3) and by its appearance in agentgid's top-4 weekly downloads (E1). 'Fastest raw growth' holds among the ranked code frameworks; Dify/n8n (visual builders, out of scope boundary) were not compared.",
      "confidence": "high"
    },
    {
      "result_id": "V8",
      "claim": "LinkedIn, Uber, and Klarna use LangGraph in production.",
      "evidence_ids": [
        "E15"
      ],
      "status": "partially_supported",
      "reason": "The vendor page (opened) does name all three. Auditor hunted counterevidence/corroboration: Klarna-LangGraph is widely echoed (theapplied.co, Blockchain.News, Sequoia commentary) but every echo traces to LangChain's own customer story — vendor-originated, not independently confirmed. No third-party confirmation of the LinkedIn and Uber claims was found in the bounded audit. Production use is vendor-asserted; the report must say so.",
      "confidence": "medium"
    },
    {
      "result_id": "V9",
      "claim": "LangGraph exhibits five recurring production failure patterns: unbounded checkpoint state, recursion-limit terminations, last-write-wins concurrent state loss, checkpointer connection exhaustion, and unresumable interrupt state after restart.",
      "evidence_ids": [
        "E18",
        "E22",
        "E30"
      ],
      "status": "verified",
      "reason": "Cited page re-opened — the excerpt is the article's own failure-pattern summary, mechanism-specific and internally coherent. Direction corroborated by two sources the auditor did not gather: diagrid's durability analysis (E22) and the 50-agent rollout post (E30, now opened — see V16). No source contradicting the patterns was found.",
      "confidence": "medium"
    },
    {
      "result_id": "V10",
      "claim": "CrewAI shows recurring production failure modes (silent context truncation, hierarchical stalls, unbroken tool loops, cost multiplication, memory inconsistency) and opaque hierarchical routing, and is oriented to demo velocity over production platform work.",
      "evidence_ids": [
        "E19",
        "E20",
        "E21",
        "E16"
      ],
      "status": "verified",
      "reason": "Three cited pages re-opened, each first-hand and mechanism-specific; the three are independent of each other (consultancy writeup, two-migration practitioner, enterprise-essay). Notably the vendor's own blog (E16) concedes trust/quality is 'the top barrier to production' — an admission consistent with the critiques. No contradicting source found.",
      "confidence": "medium"
    },
    {
      "result_id": "V11",
      "claim": "Microsoft Agent Framework's resume is entirely manual — restore_from_checkpoint requires an explicit checkpoint_id, with no supervisor, scheduler, automatic restart, heartbeat, lease, or watchdog.",
      "evidence_ids": [
        "E23",
        "E22"
      ],
      "status": "verified",
      "reason": "Page re-opened; the author states the finding comes from reading the actual source code (Runner.restore_from_checkpoint), and the quote captured matches. Commercial interest (Diagrid sells durable-execution tooling) is disclosed on the same page and noted; direction is corroborated by ZenML's independent runtime-gap analysis for the adjacent OpenAI SDK (E24).",
      "confidence": "medium"
    },
    {
      "result_id": "V12",
      "claim": "The OpenAI Agents SDK carries a model lock-in surface (designed around OpenAI APIs; provider switching requires work) and needs an external production runtime for durable execution.",
      "evidence_ids": [
        "E25",
        "E24"
      ],
      "status": "verified",
      "reason": "Both pages opened; lock-in description matches the SDK's documented OpenAI-API-centric design. Both sources have commercial interest in the runtime claim (ZenML sells one; Orange ITS sells consulting) — noted on each record and offset by consistency with E22/E23's durability findings.",
      "confidence": "medium"
    },
    {
      "result_id": "V13",
      "claim": "Google ADK's 1.0 release broke existing users' code despite being presented as production-ready, with upgrade failures reported across GitHub issues.",
      "evidence_ids": [
        "E26"
      ],
      "status": "verified",
      "reason": "DLabs quotes are second-hand developer statements, but the auditor found direct primary corroboration: the official v1.0.0 release notes (2025-05-20) list '⚠ BREAKING CHANGES' (eval schema, BuiltInCodeExecutor replacement, all services async), and issues #808 ('create_session Fails... for ADK 1.0.0'), #970, #978 ('Agent Engine is not ready for ADK 1.0.0') document upgrade failures. The subjective 'timed for the conference' framing remains opinion and is not relied on.",
      "confidence": "high"
    },
    {
      "result_id": "V14",
      "claim": "Google's Agent Runtime documentation records ~4.7s cold-start latency at min_instances=1 under 300 concurrent requests (vs ~0.4s warm).",
      "evidence_ids": [
        "E27"
      ],
      "status": "verified",
      "reason": "Official docs page opened; figures appear exactly as recorded. It is authoritative for platform behavior and is correctly classified contextual (vendor describing its own platform), not as the independent account RQ4 requires.",